<?xml version="1.0" encoding="UTF-8" standalone="no"?>
<!DOCTYPE biblioteca SYSTEM "biblioteca.dtd">
<biblioteca>
    <libro id="L0001" n_paginas="435" tipo_clase="novela">
        <titulo>Titulo de libro</titulo>
        <indice>Índice</indice>
        <sinopsis>Sinopsis del libro</sinopsis>
        <capitulo n_paginas="35">
            <titulo>Título capítulo 1</titulo>
            <contenido>&contenidocapitulo1; </contenido>
        </capitulo>
        <capitulo n_paginas="400">
            <titulo>Título capítulo 2</titulo>
            <contenido>&contenidocapitulo2;</contenido>
        </capitulo>
    </libro>
    <revista id="R0010" tipo_clase="informatica">
        <numero>Número de la revista</numero>
        <titulo>Título de la revista</titulo>
        <indice>Índice de la revista</indice>
        <seccion n_paginas="15">
            <contenido>&contenidorevista;</contenido>
        </seccion>

    </revista>

    <periodico id="P0001" tipo_clase="nacional" fecha_pub="07/05/11">
        <seccion_per tipo="economia">
            <articulo autor_art="Pepe perez">
                <contenido>&contenidoarticulo;</contenido>
            </articulo>
        </seccion_per>
        <indice>Índice del periódico</indice>
    </periodico>
</biblioteca>